{
  "schemaVersion": "1.0.0",
  "name": "discovery-defaults",
  "description": "The reads the guided discovery step issues: one Azure Resource Manager GET, whose text is a request path, and one Resource Graph query. Signal presence is not read in v1 (issue 142). Framework defaults only. Every entry is workload-neutral and names no workload type, because wizard/discovery/ is a core path (FR-63, CC-022, CON-11). Each query is written on a single line so it travels as one argument and records as one line of evidence.",
  "entries": [
    {
      "id": "subscription-readability",
      "origin": "frameworkDefault",
      "capabilityClass": "readResourceMetadata",
      "queryText": "/subscriptions/{subscription}/providers/Microsoft.Authorization/permissions?api-version=2022-04-01",
      "queryHash": "b082cedf5b20a53ab0bf100c0a47f9b90b004f166d1a4c7d0df547d03ea48aa9",
      "reviewedAt": "2026-10-01T00:00:00Z",
      "purpose": "Establish that the identity can read every resource in the named subscription before anything is enumerated. An Azure Resource Manager GET issued through the broker, not a Resource Graph query: Resource Graph returns the subscription row to an identity with any role inside it, so a container read passed for one resource group (issue 144). Discovery requires */read or * with no exclusion that could touch a read."
    },
    {
      "id": "subscription-resources",
      "origin": "frameworkDefault",
      "capabilityClass": "readResourceMetadata",
      "queryText": "Resources | project id, name, type, location, resourceGroup, subscriptionId | order by id asc",
      "queryHash": "3d10a79f8f8392073532b925d722842aee7ad7acf45e45db82207c6e66a81c0e",
      "reviewedAt": "2026-09-29T00:00:00Z",
      "purpose": "Enumerate every resource the identity can read. It filters on no type, because deciding which types are candidates belongs to an installed extension (ELI-004) and a default type filter here would be workload content in a core path. The projection is a fixed field list rather than a wildcard, so no row carries data nobody chose to collect. Tags are absent: a tag is operator-controlled free text and the likeliest place a secret-shaped value appears. Ordered by id, for byte-stable output."
    }
  ]
}
